{"checks":[{"check_id":"quality","configuration":{"capabilities":{"ifc.read":"full"}},"failure_mode":"fail","kind":"capability.minimum","severity":"error"}],"evaluation_time":"2026-07-13T00:00:00Z","policy_id":"delivery","policy_version":"1.0.0","profile":"https://aecctx.dev/gate/v1","waivers":[{"approved_by":"AECCTX test authority","check_id":"aecctx.policy.quality","expires_at":"2026-07-01T00:00:00Z","finding_fingerprint":"ebdcf1ca0462973703f7d0a2662257f98120664a7484659da2d4a6327d2298de","issued_at":"2026-06-01T00:00:00Z","reason":"bounded project-authored conformance fixture","waiver_id":"reviewed-exception"}]}
