{"checks":[{"check_id":"quality","configuration":{"max_count":0,"threshold":"warning"},"failure_mode":"fail","kind":"diagnostic.maximum","severity":"error"}],"evaluation_time":"2026-07-13T00:00:00Z","policy_id":"delivery","policy_version":"1.0.0","profile":"https://aecctx.dev/gate/v1","waivers":[]}
