{"checks":[{"check_id":"baseline","configuration":{"categories":{"added_records":"allow","artifact_changes":"allow","capability_regressions":"allow","changed_records":"fail","identity_changes":"allow","loss_changes":"allow","producer_changes":"allow","removed_records":"allow","version_changes":"allow"}},"failure_mode":"fail","kind":"diff.regression","severity":"error"}],"evaluation_time":"2026-07-13T00:00:00Z","policy_id":"delivery","policy_version":"1.0.0","profile":"https://aecctx.dev/gate/v1","waivers":[]}
