{"checks":[{"check_id":"ids","configuration":{"ids_sha256":"3411c21141257195ed67f9d36a8efe54db9ede711c0a4df2cd64465879d41dea","source_id":"src_ef0223a8e19055829dc935ab"},"failure_mode":"fail","kind":"ids.specification","severity":"error"}],"evaluation_time":"2026-07-13T00:00:00Z","policy_id":"delivery","policy_version":"1.0.0","profile":"https://aecctx.dev/gate/v1","waivers":[]}
