{"checks":[{"check_id":"ids","configuration":{"ids_sha256":"7a4210356b417e3f7b5a86425d1b306cff189575ad056d05722e1f7153b562ae","source_id":"src_a2996f385b4773fa2a72b8dd"},"failure_mode":"fail","kind":"ids.specification","severity":"error"}],"evaluation_time":"2026-07-13T00:00:00Z","policy_id":"delivery","policy_version":"1.0.0","profile":"https://aecctx.dev/gate/v1","waivers":[]}
