{"checks":[{"check_id":"quality","configuration":{"actions":{"conflicted":"allow","explicit_null":"allow","not_applicable":"allow","unknown":"requires_review","unsupported":"allow"},"field_path":"value","record_types":["assertion"]},"failure_mode":"fail","kind":"value_state.action","severity":"error"}],"evaluation_time":"2026-07-13T00:00:00Z","policy_id":"delivery","policy_version":"1.0.0","profile":"https://aecctx.dev/gate/v1","waivers":[]}
